,Title,Id,Text,Author,Number of Comments,Number of upvotes,Ratio of Upvotes
177,"ELI5: If ASML is based in the Netherlands, why is Taiwan a semiconductor manufacturing powerhouse?",11s8b5x,"Since ASML is based in the Netherlands, and could sell their chip lithography equipment anywhere, why has Taiwan become the premier semiconductor manufacturer? Why can't a country with a similarly deep and complex manufacturing capacity (US, UK, France, Germany, Italy, Japan, S. Korea, Canada etc.) substitute Taiwan for chip manufacturing? What is so unique about Taiwan's manufacturing that microchips are best if produced there and why couldn't that be recreated elsewhere?

I can't believe it has to do with transport costs, since microchips are very valuable by weight and volume.",Obelix13,6,3,0.71
178,ELI5: What are COCO bonds?,11s6vbh,Especially in the context of distress situations like surrounding Credit Suisse?,4westofthemoon4,1,0,0.5
179,ELI5 how does LED and smart lights generate different colour lights,11s592g,"The smart light bulbs and led have options to go through the colour pallet and change the colour but how? How does the tiny light change color from white to red or any other color 


and how does it make black light like the one in the dark mode right now how can it make black color pixels",Miserable-Scallion87,3,0,0.33
180,ELI5: How did astronomers notice deviations in Uranus's orbit to the point that they predicted Neptune?,11s33gx,"It's hard for me to image that several centuries ago, based purely on observations from what may have been fairly simple telescopes - astronomers could: 

1. Precisely observe deviations in the orbit of Uranus
2. Predict a planet with 2 unknown variables (its mass, its position)
3. Discover it in the night sky

It's blowing my mind that all of this was/is possible simply by looking at the night sky. How does the math here work?",shash747,2,2,0.58
181,ELI5- what does it mean to have veins that “roll” or “deep veins”,11s2mzv,"My mom has always told me that our veins roll, and today when getting blood work the woman mentioned something about me having a deep vein",ratgarcon,4,0,0.5
182,ELI5: Why does the London Underground have wires on the side of the tracks?,11s2kxc,"Everywhere when I am on the Underground, I always see those wires that appear on the side of the railway lines. I see it in the tunnels passing the windows when the train moves. 

They are also used as a fence when it's on the surface. But what is the use of those wires? 

Tube trains conduct electricity from 4th rail, so what is the reason of having wires on the sides?",Comfortable-Table-57,8,6,0.72
183,eli5: What is a second mortgage when you are buying a home?,11s2b6o,"If you are in the process of buying a home and a second mortgage is proposed alongside the main mortgage, what does that mean? Would you be paying both a main mortgage and a second mortgage at the same time?",No_Restaurant1377,14,2,0.6
184,ELI5: how do we know a thermometer is accurate?,11rzq4y,Who came up with zero degrees as a number? How do we know they were accurate?,GrimmReefer603,17,0,0.25
185,ELI5 - APR Given vs Reality,11rywjv,I recently purchased a vehicle and created an amortization schedule. Why did I need to change the APR listed on the Bill of Sale (8.34%) to 8.46% on my spreadsheet in order to make the formula equal the accurate monthly payments?,shro0med,16,26,0.75
186,"ELI5: Dollarization, fix peg and free float",11ryrzu,"Economics class and I don't understand much of what's written in the textbook, could you ELI5 the meaning of these terms?",OpiumVision,2,0,0.2
187,Eli5-Electric vehicles,11rwwe4,"Eli5, since gasoline and diesel powered vehicles use the engine for heating the vehicle. How do electric vehicles get heat?",I_am_pretty_sure,7,0,0.42
188,eli5: why back hurt on soft mattress? but back don't hurt on hard mattress? and vise versa?,11rwdj2,"What is it about a soft mattress that causes lower back pain? why do some ppl need a soft bed? and also, why does the problem diminish when using a hammock?",Upset-Establishment4,11,0,0.33
189,Eli5: bureaucratic pathology,11rw88u,I’ve read so much about this put I just understand that it’s a corrupt bureaucracy and that’s it. I don’t understand the whys and hows. Thanks,selectnewuser,1,3,1.0
190,ELI5: Where is each OSI Reference Model 1-7 layer header read in a network and what is the result of each of those readings.,11rvuj8,"I know routers read layer 3 header and based on that forward packets to its destination. What about other OSI Reference Model 1,2,4,5,6,7 layer headers.",Wild-Ad-9019,5,0,0.25
191,[eli5] Rocket Heat Shield,11rvb3v,"If a rocket needs a heat shield on re-entry into the atmosphere, why does it not need one during launch? Is the speed difference really that drastic?",AlexKucera,10,4,0.75
192,ELI5: How do insects deal with sunlight in their eyes given that they have no eyelids and no moving eye parts?,11ruwt7,"For example, let's say that an insect is flying toward the direction of the sun, how do they block off the brightness of the sunlight?",Love_of_Mango,585,5674,0.95
193,Eli5: How are images in our head created?,11rupt2,"Like, when someone says ""imagine a purple apple"", how do we bring this image in our heads?
It seems by the way, that we ""space out"" during this imagination process",Big_carrot_69,10,0,0.4
194,ELI5 how do paper straws help the sea turtles?,11ru0s4,"If you just throw away the plastic straws, like normal and not into the ocean, how do plastic straws that go to the landfill end up in the ocean? From my understanding landfills are always on land (hence the name) and never even touch the water without deliberate action. How does plastic straws thrown normally into the garbage affect the sea turtles? Do landfills just dump into the ocean as well?",Disastrous-Scheme-57,8,0,0.4
195,ELI5: How does water both reflect light and let it pass through?,11rt77b,This just seems contradictory and confusing to me.,lJedl,7,5,0.73
196,ELI5 Why do all color in natural landscapes match so well?,11rt1pq,"Pretty much all the natural landscapes I've seen have beautiful color palletes. The colors of the sky, the trees, and the everything matches so well. But why is that so?",CeJota_,4,1,0.57
197,ELI5 how calories deficit works with junk food. Is it still healthy?,11rskwa,"Afaik, a calorie deficit is when you consume more/fewer calories than you use. If you are losing weight, you consume more calories than you use to work out, and if you are bulking up, you consume fewer calories than you use. Right? So I read articles about how calorie deficit is key when trying to gain/lose weight. How does junk food play a factor in this? If you just eat junk food and the calorie is still less than you use, do you still lose weight? So technically, if you just eat pizza and burgers and work out do you lose weight? But it cannot possibly be healthy, can it?",teehee99,22,0,0.45
198,ELI5: how do water birds not get cold swimming?,11rsji0,I just moved recently near a pond and always see geese and ducks swimming even when it’s snowing or when half the pond is frozen and it just does make sense how they aren’t cold!,crazypantts,2,4,0.7
199,Eli5:How do trains stop?,11rsht2,If a train has smooth round wheels and the track is also smooth how do the brakes make them stop?  The friction coefficient must be very low. Is it purely the weight of the thing?,KMcCaul88,14,2,0.63
200,ELI5 clear TPU or silicone case turning yellow,11rsa4s,Why is it that when silicone or TPU clear cases are stored for selling they dont turn yellow but they do when are already purchased and being usedfor quite sometime?,Learner1_,2,0,0.5
201,Eli5- How can someone acting in a film or tv program also direct it?,11rr86k,"I don’t understand how someone can ‘direct’ themselves in a film or tv program. Do they have an assistant director to direct the scenes they are acting in, or do they have to rewatch every scene they act in and reshoot if necessary?",lozboz1234,8,11,0.75
202,Eli5 How online games work,11rqdqr,"I still don't get it how is possible that if you play online (especially fast fpp game) you and other people see the same things, and actions in real time in whole world. If we have computer and we do some action for example shoot or jump, we must provide input information to our computer then it goes via Wi-Fi and further to network to game server and game server distribute this information to other players, it take time. But everybody see this In the same exact moment!! It's insane. Please explane this to mee because it's bugged me over and over. Thank you 😊",Daymon_f,27,14,0.77
203,ELI5: How do atoms create DNA?,11rphfg,How do they come together to create DNA? How do they know?,Ivebeendoingurmom,7,0,0.22
204,ELI5: why is titanium so good at fusing with bones?,11rp5sp,Why is it so good at fusion? Is it the atoms?,Ivebeendoingurmom,6,2,0.63
205,Eli5: Why people living in equator have dark skin than people far from equator.,11rnu2m,"Doesn't darker skin enable them to absorb more sunlight in an already sunny area? Shouldn't it be opposite, like fair skinned people in equator, so that body absorb some sunlight and darker skin towards poles so that what little sunlight they get will be easily absorbed?

Sorry if this question feels dumb ^-^",ykVORTEX,6,4,0.75
206,Eli5: how does equal day/normalized reporting work?,11rnkus,I understand normalised accounting is normalizing to compare 30 days to 31 days. I just don’t understand how it is calculated.,Airyrelic,3,3,0.68
207,ELI5: How come an engine with 300% volume only have 40% more Horsepower?,11rngqv,"I got my mc lisence last year and got myself a Yamaha Xv535 Virage. However I feel it's a bit underwhelming for my 130 kg body(with kit)  


I'm looking at a Yamaha 1600 Road Star. however My ""tiny 535cc has 44 bhp and the 1600 is literally 3 times as large, but it only has 19 more horsepower :D

&#x200B;

(And No, I'm not gonna get a sport bike, I'm a Cruicer boi)",TangoKiloSierra,15,5,0.7
208,ELI5 Electricity providers UK,11rndwt,"How does it work when you swap electricity providers. How do they get 'their' energy to your property? I'm with provider A, and provider B comes along and offers cheaper and more energy efficient power. If I switch to provider B, as far as I can work out, nothing happens to my actual properties supply. It's the same power supply, from the same sub-station powered from the same grid. How does it work?",ianm671,5,3,0.8
209,eli5: How does Compound Growth in Index Funds work?,11rm7im,"I get the idea of Compound Growth, as something gets larger, it starts to get larger faster.  I understand the example about doubling grains of rice:  1 becomes 2, 2 becomes 4, 4 becomes 8, etc...

But with Index funds, the number of shares you own doesn't increase unless you buy more.  If I own 1 share, it might grow in value, but how exactly does it grow *faster* as it grows larger?  That's the part I can't wrap my head around.",Harry73127,6,3,0.81
210,"Eli5: why does it feel good to snooze, despite our bodies naturally preparing to wake up?",11rlnup,"It seems counter-intuitive and inefficient that snoozing feels good, at least in the moment.",Delicious_Adeptness9,6,6,0.75
211,ELI5: Why does the body exhibit symptoms of illness when overtired/under-slept?,11rlglb,"I know that lack of sleep can have all kinds of negative effects on the body, I’m just unclear about what those mechanisms are and what triggers them/how they affect each other.",m-arnold,5,8,0.9
212,Eli5:What is the difference between the actual speed of time passing and human perception of time?,11rkzqx," Since we perceive time how slow or fast completely base on emotions and memory, few hours feel like only half an hour when having fun, but when we bored for half an hour feel like few hours.So in reality how fast or how slow does an hour or maybe even a second passing? Because so many chemical reactions in atomic size can happen in just under a second.",PrestigiousClient655,23,0,0.36
213,"eli5 || Why is winnipeg colder than saskatoon in the middle of winter, but saskatoon has longer winters?",11rkwuo,Its just that winnipeg goes to like -50 but saskatoon gets to -40. But saskatoon has longer winters.,TJCD8765,1,0,0.33
214,ELI5 why shouldnt you eat or drink anything after throwing up,11rjkny,isnt it better to drink water afterwards so that youre not dehydrated,pisscorn,6,0,0.25
215,ELI5 : How does an international driving license work?,11rjey7,Topic. Can I convert any license into one?,Paradoxbuilder,15,9,0.77
216,"ELI5: With the world overflowing with plastic, is it that much more of a pollution issue to burn plastic just to get rid of it?",11rip22,"Of coarse we want to limit our use of plastics and do everything we can to save our planet…but with plastic often difficult to recycle, landfills overflowing, floating plastic islands in our oceans, and micro-plastic in our water, how much more harmful is it to encourage burning plastic?",birdwatchrWA,3,1,0.52
217,"ELI5, Chem Question: What is/does/are ""phenolates""?",11rimc6,"ELI5: Phenolate part of Mycophenolate. 

Mom takes perscription mycophenolates, for polymyositis (autoimmune disorder), while I know ""myco"" is fungi (learned when I watched QI clips, lol), but I have no idea what a phenolate is. Is it like an ester? Does it coincide with the Myco-? Does it affect biological absorption? (Google calls it salt-based, but shells out whitepapers, etc... beyond my understanding.) 

PS, I'm not in Biology/PolySci and have a computers/linguistics background.",swehttamxam,2,0,0.3
218,ELI5 - What is a logarithm?,11ricwh,I've researched it so many times but I just can't get the concept of logarithms into my head,holyorchid,134,403,0.91
219,ELI5 How do atoms produce so much energy if they are so small?,11rhxd7,"If they are so small, how do splitting atoms produce so much energy? I get that there could be billions if not trillions of atoms in things, but I still don’t get how these teeny tiny building blocks produce so much energy. (An example I read is that if you were to split all of the atoms in a paper clip, it would have a yield of 18 kilotons of TNT??? How??)",Lord_Lykan,17,0,0.43
220,ELI5 Why does the Government pay higher interest rates when the bonds they issued are fixed rate.,11rh1wm,"I see so many posts about how the government will have to pay X amount in interest payments if the Fed Funds rate goes to Y amount. But the government issues bonds in return for money i.e. they issue debt at a fixed rate. So they would only have to pay a higher rate for new bond issued, right?",A97k,3,1,0.57
221,ELI5: What is the purpose of a Clapperboard in film-making?,11rgyb7,"I feel like they’re an instantly recognizable symbol of film making. Everyone has seen one but I only recently learned what they are called and have no clue what they are used for.

Edit: Got the answer, Thanks!",KaiWood11,474,4300,0.9
222,ELI5 How do on-ground aircraft collisions happen?,11rg5o6,"I often see news about one plane’s wing colliding with another’s fuselage or something similar, but how does it happen? Is it pilot error, ATC error, something wrong with the markings on the tarmac or something else altogether?",fjv08kl,3,1,0.6
223,"ELI5: How are languages like Japanese, Chinese etc “conceptually” different from a language like English?",11rfwd4,"This is what I was told makes learning the language so difficult as an English Speaker (and I assume the same as learning English as a speaker of Japanese for example). For reference, I am an English speaker however am somewhat proficient in Spanish and I feel as if, for the most part, translating between the languages is straightforward. 
Is it just written language or spoken? Or both?",Forbiddenjalepeno,35,8,0.62
224,ELI5: what does a college conference commissioner really do?,11rehrm,"This was prompted by recent SEC events (Ole Miss - Chris Beard; Auburn - Hugh Freeze; Alabama - Brandon Miller; Georgia - multiple arrests; Texas A&M - Bobby Petrino, Dj Durkin; …)

It seems like commissioners have little real authority to force ADs to do “the right thing” (whatever THAT is). 

So: what’s the value in having a conference commissioner?",PullThisFinger,2,1,0.57
225,"ELI5 why are volunteer firefighters a thing, but not for other professions? You don't see volunteer police or teachers.",11re0xd,"I was thinking about this since I know someone who is a volunteer firefighter. He doesn't receive monetary compensation for volunteering even though he went through all the training (fire academy, among others), so I guess that might be part of why people wouldn't want to volunteer to put themselves in dangerous situations for no compensation other than the satisfaction of helping their community. 

But why are volunteer firefighters a thing? And if people, upon proper training, could volunteer as firefighters, why not police officers? Teachers? Nurses?",Nefarious_Mistake,135,189,0.85
226,Eli5: how does the human brain cope with prolonged exercise?,11rcx29,"Despite being a nurse, this always bothers me. The human brain consumes 20% of glucose at rest. Yet, when we exercise, we increase our metabolic requirements all over the body, including the brain. How do our bodies accommodate the increased demand and protect the brain from the drop in oxygen and glucose from exercise?",DoctorMobius21,11,10,0.7
227,Eli5 What is a credit card balance transfer and what does it do?,11rcwq6,I’ve tried searching for like 20 minutes and I’m still confused. Thanks guys!!,Shanegibson66,7,0,0.5
228,Eli5: Nails Spas & Massage Parlors Mostly Ran by Asians?,11rco37,"Hi all. Before I begin, I hope this question doesn't offend anyone. I mean no disrespect at all.

I was wondering - why are most (if not all) nail spas ran by Asians? It also seems that most massage parlors are mainly ran by Asians as well. I went to the mall today and walked by 3 massage (kiosks/booths?) and they were all Asian ran.

Just genuinely asking. I hope this does not offend anyone, and I'm more than happy to change or correct any misinformation that I may have put.

Thanks!",kenneth196,9,2,0.56
229,ELI5: How do ants operate?,11rcbel,"I'm watching them figure out a bait trap. Any one ant seems to have no clue wtf is happening and they seem to wander aimlessly. Then I come back hours later and they have formed a direct line to the bait. I know they lay pheremones once they found food, but are they just like Roombas where they bounce around until they find food, then they lay a trail? How do they know how to get back to the colony? Were they laying a trail of a different scent the whole time that just said, ""I'm only looking, haven't found anything!"" How does all this work with ants?",johrnjohrn,3,10,0.81
230,Eli5: Why are syllables so important for keeping songs on beat?,11rbuho,"For example, using a 2 syllable word instead of a 3 syllable word could send a song off beat.",Consistent_Bit_5438,3,0,0.4
231,[ELI5] What is an advantge of tapeworm's cuticle being a syncytium rather than many cells next to each other?,11rbexp,"I know why it's beneficial for our muscle fibres to be syncytia but how is it beneficial for tapeworms?  


And what about their glycocalyx - how does it protect tapeworms from enzymes?",czypsycebulowe,0,1,0.56
232,ELI5 What is GitHub and how is it used?,11rafkj,"Recently, I learnt some Python and basics of NumPy & Pandas. On the final day, Our instructor made us create a GitHub account, and told us to ""use it for coding practice"" and ended the meeting then and there. He hasn't been responding to our emails asking for further explanation on how to go about using GitHub. Thanks in advance for the answers!",Weird-Thread,10,8,0.67
233,ELI5: Why is vision insurance treated differently by employers?,11ra8x7,"For my specific employer, it’s wholly paid for by the employee.  Personally, I could avoid the doctors office/ER for years, but I would lose most ability to function without glasses/contacts.",quetepasa666,37,4,0.57
234,"ELI5: Why people who bought a home with a historically low mortgage rate can ""never move out""?",11r92z2,"Seeing a meme on Tiktok about people lamenting the fact that they brought a home at mortgage rates lower than 3.0% between 2020-2022 and how they will never be able to move into a new home. 

Not sure if it's supposed to be a bit of a humblebrag in the sense that it makes other future home purchases feel like a bad deal, or if there's something else I'm not putting together that makes the purchase an actual bad investment.",HeyItsMau,426,674,0.89
235,"ELI5 where does the money for space force actually, go?",11r80cp,Army (domestic lands) Navy (domestic waters) Air Force (domestic skies). It's listed as a tertiary division of the Air Force. Please. Someone adequately explain?,Silent_Special_9024,13,1,0.55
236,ELI5: How do they create computer games for unreleased games consoles?,11r7c4e,"Games with long development cycles, like GTA6, how do they create the content without knowing what the unknown hardware can handle? Is it educated guesswork until a dev kit is available?",radiofreduk,8,7,0.71
237,ELI5 why Pi is important?,11r4okq,"I understand the mathematical definition of Pi, but why does it end up being used in so many formulas and applications in math, engineering, physics, etc? What does it unlock?

Edit: I understand Pi is the ratio of circumference to diameter. But why is that fact make it important and useful. For example it shows up in the equation for standard normal distribution. What does Pi have to do with a normal distribution. That's just one example.",akchahal,92,128,0.83
238,ELI5 How do Xbox/PlayStation run 130fps consistently when a 300 euro pc couldn't?,11r45bi,I'm so confused. I have an Xbox series S wich I bought for 300 euro. This can run things like. Fortnite at 120 fps all the time but a 300 euro self built pc couldn't? I'm so confused and dumb.,Kozumato_,11,0,0.38
239,ELI5 How come we're told not to exercise when sick?,11r2p8s,Our lymphatic system moves lymph fluids through the contraction of our muscles. Wont it benefit us if we exercised while we're sick?,--Kitsune--,21,33,0.71
240,ELI5: What are the reasons for Inuit poverty and food insecurity?,11r2k7l,Did they always use to have food insecurity or has their situation become worse in modern times?,unenkuva,22,6,0.6
241,Eli5: How does Speed Camera or Radar work?,11r26k9,How can the radar capture a specific vehicle moving at a specific speed while there are other vehicles moving alongside?,notaf4,12,19,0.76
242,ELI5 Gene Splicing,11qxx3e,Can someone explain in simple terms what is gene splicing?,tanyichen01,2,0,0.4
243,ELI5 What causes abdominal pain after consuming a food your allergic to?,11qxc1h,"(Edit: You're) When I consume food Im allergic to it causes a terrible food poisoning type of pain that lasts for as long as the food is present. Sometimes its immediate and sometimes it takes hours later to set in.

I know its not the food (gluten for example) literally doing this and its actually a reaction on the behalf of my body.

Im curious what exactly is causing the pain? Are IgE particles or white blood cells literally binding to the internal organs and causing damage?

And another question is why does that happen?",Melodic_Cantaloupe88,2,7,0.71
244,eli5 why the hell are spineless chairs/stools impossible to sit in for more than an like ten minutes ?! Why is it so hard? Do i use the back rest that much?,11qvv0d,It doesn’t even help that my posture is garbage. Do I have a weak back or something,jameztobias,8,7,0.62
245,ELI5 How do universities tuition too high,11qtzca,"As I know, may be I am wrong.  1.Most colleges and universities are not-for-profit or state funded with tax money.  2 Most professors and associate professors don't have millions dollars salary.  3. They don't pay property tax or sales tax.  So most expenses are low, so then why the tuitions are raised much higher than inflation.  In profit businesses, we can blame shareholders, greedy CEOs, greedy doctors,  greedy lawyers, but not for profit colleges and universities explanation for high tuitions.",tennyw,7,0,0.22
246,ELI5: Why does Aluminium retain smells from it's proximity?,11qs44j,"I just took a can out of the fridge that was next to some potent French cheese and the can (I whiffed it with my nose) smells like the cheese. I've also had an aluminium pan, that was ""non stick"", but it smelled like whatever burnt mess it would make.",dirtyqtip,5,0,0.38
247,ELI5: how does honey stay fresh and not go bad in the cupboard?,11qs2ls,"It seems like you can store honey indefinitely outside of the refrigerator. You'd think with the sugar content, moisture, and lack of acidity, mold would develop quickly but it doesn't. What gives?",Bodysnatcher79,16,0,0.5
248,eli5 what's the difference between an architect and engineer?,11qs1y5,"Seem to me that an architect is just an engineer with an art degree 🤔 surely there's more.



Update:Thank you for all wonderful answers.",clover_username,16,0,0.42
249,ELI5: Bhom's Implicate Order please,11qksib,I've tried to understand the theory but some descriptions are not beginner friendly and the videos on YouTube are a little confusing.,RoberToby2012,6,1,0.55
250,ELI5 what makes cobalt bombs much more dangerous than other nukes,11qkqnv,"I’ve heard the fallout is much worse but I don’t know why, especially compared to other nukes. What makes the cobalt so dangerous?",OldKingBramble,19,87,0.87
251,Eli5: What are options in finance?,11qk86a,"On a basic level what are options and options trading?

Edit: thanks! Makes sense now",NotintheMossad,9,2,0.57
