,Title,Id,Text,Author,Number of Comments,Number of upvotes,Ratio of Upvotes
403,ELI5: Is the weight you gain during pregnancy the same weight you would have gained anyway due to eating more/moving less?,11n1yly,"I’m pregnant and gaining weight at a normal rate. I’ve been a constant healthy weight for my entire adult life so I kind of know my body, how much food it needs etc. I’m not tracking calories or anything but I feel like my food intake has been pretty similar to pre pregnancy. So, would the 20+ lbs I gained have been there no matter what or is something else going on?

Side question: If something else is going on during pregnancy to make you gain weight, then is cico really the end all/be all of losing weight and dieting?",Miss-Molly-Lynn,18,3,0.57
404,Eli5 static in programming,11mzygm,To this day I still don’t understand what static means!,onetimeuseaccount__,22,8,0.63
405,ELI5: The British secondary school system,11mzmgm,"My country adopted the American school system so at first glance the British school system seems so convoluted by comparison. American school system is direct as can be-- if you pass 12th grade and the SAT them boom you graduate and go to college. 

But I haven't been able to wrap my head around the British model. What are O Levels and A Levels and how are they different from each other? How many of each do you need to finish school? Is there another set of entrance exams you need to take to get into a university?",astarisaslave,9,1,0.6
406,eli5: Why do you need a prescription to get a CPAP machine?,11mz9rd,"I snore like Snorter Mcphail of Dr. Seuss fame, minus the bucket on my head. My wife would rather see my head in a box while I'm snoring.  My snoring is loud and horrible.  Why in the world can't I just buy a cpap machine?  I understand getting a PX for drugs or therapies; some could be unnecessary or wasteful if given out with no one checking for symptoms or necessity. What makes a cpap so special?  It is an air blower machine, it blows air.  Probably someone is making money by keeping cpap behind the PX curtain.",funktaxi,30,15,0.65
407,ELI5: How does a system of pulleys make it easier to lift something?,11myk6c,"I know that pulleys change the direction of force, but how does that make it easier to lift something? Why does it create ""mechanical advantage""?",wontonphooey,51,63,0.85
408,eli5 Why is the Sherman Antitrust Act of 1890 and Clayton Antitrust Act of 1914 so ineffective against companies today?,11mxwvx,"How have companies such as Vanguard and Blackrock or Nestle, Pepsi, Coke, grown to be as big as they are with these 2 Acts in place. It should prohibit them from growing to these sizes but they only seem to be getting bigger.",cstuart1046,161,708,0.91
409,eli5 What is Embezzlement?,11mxsnm,What is this financial crime?,NoVisit5893,6,0,0.5
410,ELI5- is earth spinning faster or slower?,11mxdyb,"When looking this up on google, I’m seeing both that it’s faster and slower. Which is it?? And why?",ratgarcon,3,0,0.46
411,"ELI5: What's in energy drinks that provides the ""kick"" that one otherwise doesn't get from coffee, tea, etc?",11mtpik,"Should mention that I drink only no sugar drinks, so it can't be that, and a single can of what I have is usually no more than 200MG of caffeine

Edit: Appreciate your responses. Thank you for the explanations and insights",m_t_rv_s__n,1735,6032,0.91
412,ELI5: how was ice transported to places like Hawaii? Wouldn’t it melt?,11msx91,"I read a NYT article about icetok and they mentioned that before the invention of fridges, ice would be taken from cold places and transported to places in US, including Hawaii. How was that possible? Wouldn’t the ice melt before arriving to the destination, given that there were no fridges at the time?",idonthavealizard,154,412,0.89
413,eli5 How do engines idle,11msj52,Whenever an engine is idle it still spins right? Thats why they still make noise and vibrations? Where does all the spinning power go?,Mobile_Zebra8013,5,0,0.33
414,Eli5: Are there species that don't behave like others when it comes to the continuum of their existence/survival?,11mrsnq,"Like for example , species that are not interested heavily in making a lot of babies to expand and continue the survival of their species.",Big_carrot_69,16,2,0.67
415,ELI5: Antibiotic resistance bacteria,11mqs7i,"How do bacteria become antibiotic resistant? Yes, overuse but what’s the science? Why haven’t they come out with newer antibiotics to address that issue?",ValuableAd7841,10,0,0.5
416,ELI5 how does all the products/services in the market get sold?,11mpwi3,"If nearly everyone is a labourer, and everyone has to consistently get paid less than the value of the product/service they produce. So the money in the economy is always consistently less than the value of the market.",SpaceExplorer6969,15,0,0.29
417,"ELI5: How do certificates work (in the IT space), what is the impact of expired certificates, and how do companies manage them?",11mp4ih,"I kind of understand the basic TLS/SSL handshake concept when visiting a website, but from what I understand, large organisations have to manage thousands upon thousands of these types of certificates. What are they?!",NayLay,5,5,0.7
418,ELI5: why do bruises take 1-2 days to form?,11mo20a,I slipped off a chair and fell on top of it the other day. The first day it was just red and I got a big bruise 2 days later. What's the process? What's the body doing during all that time?,submissive-wand,5,20,0.78
419,eli5 how does scaling work in maths?,11mnfrf,"I'm in 12th grade at the moment and I have an assessment that requires me to create a community centre (basically a park with buildings) but I have to create it in exact scale. My work is supposed to be like, 100m by 60m but I can't figure out how to size it exactly onto an A3 piece of paper.

I've asked my maths teacher multiple times to explain it to me but the way he explains it is for a university student and I don't understand what to do, I'm not that smart when it comes to math, I can do like easy stuff but I'm basically at a 6th grade level in everything apart from English :'(",kryptik_klown,11,3,0.6
420,"Eli5: Why do toddlers sleep with their bum in the air, and at why do we grow out of it?",11mmonf,"As title suggests, why do they do it, and why do we grow out of it as we get older?",BasslineToad,38,40,0.77
421,"ELI5: Why are L4 and L5 stable while L1, L2 and L3 are not?",11mmnzf,"Perhaps L4 and L5 aren't \*perfectly\* stable, or maybe they are, but why are they more stable than L1, L2 and L3?",SpaceWizard360,19,2,0.6
422,ELI5:Why do muscles weaken after not working out for awhile?,11mmiex,I know you become sore after working out because of little muscle tears and they heal but shouldn’t it stay the same?,damianvee,10,1,0.6
423,eli5: Submarines and Aircrafts,11mlzp5,"The submarines and Military aircrafts are both designed to be stealthy. If the planes cross section can be made equivalent to a bee or a bird, why cant the same type of coat be applied to the subs to make them appear much smaller. Wouldn't that coat would be much more efficient and cheaper than putting inches thick rubber on the subs and would also make the submarine more efficient in fuel/battery consumption.

Edit: I am assuming sonar and radar work on the same principal but in different mediums.

Edit 2: This is question is in respect to the RAM (radar absorbing technology) and SAM (sonar absorbing technology)",Cucumber_Certain,13,3,0.8
424,ELI5 why the kind of injury created by scald is different from that created by dry heat,11mlrjt,"As someone who has been burned both ways, I think I'm qualified to state this observation. I've been burned by a pressing iron and naked flame as a kid and when that happened, the effect was almost instant. The skin peeled off and the whitish inner skin started showing.

On the other hand, when it was scalded, the skin first appeared okay, then it began to swell up with build up of fluid underneath, and then it burst to form more painful sores.

Why do they both take different forms? Aren't they both damages caused by excessive heat?",Cold_Chemical5151,3,0,0.25
425,eli5 Why are some colds worse than others?,11mlqh7,"I typically get a cold and power through, but having spent the last 24 hours wiped out by a current cold I'm wondering why this time it's hit me for six? Is it because my immune system is overreacting this time or is it because I'm almost 50 and is it age related as I get older?",DimonaBoy,5,6,0.67
426,ELI5: What makes open source software better than others?,11mlm3j,"Ive seen multiple people talk about how open source programs are better but what is the benefit from it?
Edit: thanks for the explanations!",account8272,5,0,0.5
427,Eli5 below freezing yet raining,11mlg8k,"How is it possible that it can be well below freezing yet be raining all night?

Thanks everyone!",Successful_Box_1007,10,0,0.5
428,ELI5: How does resonance work. Like how can a hole and a bit of wood in front of some strongs amplify any sound energy?,11ml6x1,"Edit: Strings not Strongs* 

Plus yes i meant a guitar.",davidh92,3,0,0.5
429,ELI5: Why can’t scars be physically removed?,11mksqi,Say a person had a scar that resulted from picking a scab or not letting a wound heal properly. Why wouldn’t it work to physically take it off and give the skin another chance to heal? Particularly on shallow scars what would prevent the new scab from creating normal skin?,mrunn,10,17,0.81
430,eli5 Question about earbuds,11mkizm,When using my airpods I usually have one in at a time but when that one dies I put the other one in. How come the second airpod sounds a lot louder than the first one I had in?,GateAdministrative84,5,7,0.9
431,ELI5: Why was lead added to gasoline?,11mj13g,"I've heard that it was an anti-knock additive. But couldn't knock be reduced by other means, like just higher octane gas? It's hard to imagine that car manufacturers had no idea that leaded gas was going to lead to serious health problems.

I've also been told by old-timers that leaded gas was added to lubricate valves, and the reason cars break down so much now is because we don't add lead to the gas. But... again, isn't there some better way?",Ethan-Wakefield,39,10,0.82
432,ELI5/ why did the land now known as Germany have a history of being so divided?,11miyjo,"I’m not talking Cold War, or even anything after 1900, but basically everything that happened before 1900 for hundreds of years we had things like the holy Roman empire and various other entities but from my interpretation of maps I’ve seen, it seems like they were never really able to properly unify it Into one state, even well after other countries in Europe, figured out how to be large without all that chaos",738cj,21,20,0.7
433,eli5: why are there vertical as opposed to horizontal (or otherwise) lines / distortion in old film?,11miplh,"For example, check out [https://youtu.be/taHFUKKKmJM?t=193](https://youtu.be/taHFUKKKmJM?t=193). Look on the right side at the exact moment I link to. A vertical, dark line. Likewise, [https://youtu.be/sEUbbARHv8k?t=91](https://youtu.be/sEUbbARHv8k?t=91). (Yes, I love WW2 history).

I've never seen a horizontal line when looking at old video from that time. The best I can reason is if there's some dust or abrasive substance on the device playing the film it'll create scratches as the film rolls by. I just don't know though. ",kwende456,3,3,0.72
434,eli5 Why can't they use space suits to explore safely in Antarctica?,11mh70i,"
Recently learning more about how inhospitable Antarctica is, and difficult to explore because of that fact.  But we have suits that can protect astronaut's from space, which is also cold and deadly, so... Why not explore using those suits?",GreenBread1876,54,28,0.76
435,ELI5: How can absolute silence make you ill/sick?,11mf9cn,"Inspired by this [post](https://www.reddit.com/r/todayilearned/comments/11m5tai/til_the_prototype_of_the_rolls_royce_ghost_was_so/?utm_source=share&utm_medium=ios_app&utm_name=iossmf) of a Mercedes Benz.

Using sound suppression pads, you can create an enclosure of absolute silence, which can make you feel sick. Why is that? Is it the same for people with tinnitus?",themissyoshi,1,1,0.6
436,Eli5 how does the earth dissipate excess sun energy?,11meh1u,Overtime sun energy is stored in organic matter but how does it happen otherwise,ddh_ddh,5,1,0.57
437,Eli5: Why does sucking helium make one’s voice sound higher?,11me6qu,Just the title!,L723,10,4,0.71
438,ELI5 How do we know that quarks exist?,11md7v8,"So we know that quarks are a thing, that they have different types and even night exist in several more dimentions, right? But how do we know that if they are too small to see with all the technology we currently have? How did scientists realised there are things smaller than electrons? How does one discover anything at the subatomic level at all?",sadlittleroundfrog,12,11,0.86
439,ELI5: what's the biological explanation behind depression's lethargy?,11mbaqc,"i want to know what brain chemicals (or the lack thereof) is causing my brain to feel like sludge.

EDIT: i have major depressive disorder— i just want to know what exactly makes my brain do the shitty things it does",ex-spera,4,6,0.7
440,ELI5: why and how does SSDs are getting faster as the storage size increases? That’s almost goes against the convetional wisdom,11mapic,I was on the market for a new SSD and to my surprise the 500GB version of the product I was looking for was faster than the 250GB one (which was my original target). Then I checked the 1TB version and that was even faster than the 500GB one. How does that work?,chanashan,6,5,0.7
441,ELI5 Why does food texture significantly seem to change how we perceive if it tastes good or bad?,11m9zue,"Wouldn't all food just turn into mush when we start chewing it anyway? For example, blended cooked chicken breast sounds disgusting and probably tastes weird, and crunchy/crispy food makes something taste better, etc.",cloudsforbreakfast_,3,3,0.58
442,"ELI5: What a ""structural issue"" is/means? (When related to healthcare, the justice system, etc.)",11m96me,"I don't mean the structure of the building, how is a structural issue defined?",Nda89,13,2,0.58
443,ELI5: How do plants know when to branch?,11m91xt,"What causes a plant to branch, and why are some much more regular than others (some plants always split into 2 with consistency, some much more random)? Some species of trees grow big tall trunks before splitting, some branch early.",Smitttycakes,4,6,0.65
444,ELI5: What is IRAC legal analysis,11m8uqe,One of my criminology courses requires us to use the IRAC method to answer some questions but my professor isn’t the best at explaining it.,affectionpreys,2,0,0.5
445,ELI5: Why do airlines only have a few episodes of each show on their entertainment system?,11m81z3,"Every time I take the plane, with any airline, they have three episodes from season two, four episodes from season 5 and 7 episodes from season 11.  I'm assuming there must be an economical reason since all airlines do it but I don't understand it.

Why not package whole seasons instead of individual episodes that make very little sense as standalone? The airlines, network and customers would all benefit from that.",ZookeepergameOwn1726,6,0,0.5
446,ELI5: Why can’t you pull yourself off of the ground? Why can others?,11m6m5p,"I vaguely understand the “you are the subject applying the force to itself” so it essentially negates itself but I don’t really understand why. Hypothetically, even if someone had an exoskeleton attached to their back only extending the length of the upper body that exoskeleton wouldn’t be able to lift you either. Is there even a name for the thing that keeps this from happening?",MayGodSmiteThee,12,0,0.22
447,ELI5: Movement of a ball under running water,11m6lyk,"ELI5: I put an inflatable ball full of air under running warm water in the bathtub. At first, the ball moved around wildly, but then stabilized as the water continued to run over it. What explains the movement of the ball, and is there a way to express it mathematically?",proudly_disengaged,6,5,0.69
448,Eli5: Why do motorcycles have 2 separate breaks?,11m67ut,"Why do motorcycles have 2 separate breaks if you have to press on both to ensure proper breaking (as in breaking too much from the front throws you over and breaking too much on the rear means you dont get the good breaking power). I feel like there s a ratio that can be set in order to simplify the breaking. Also, if the law tehnically doesnt allow wheelies etc that are facilitated with the separate breaks models, why would there be 2 breaks after all?",SotirodNedlog,24,0,0.43
449,"ELI5: Why does it hurt your ears and make that ""wahwahwahwah"" sound when only one window in a car is down and you're moving fast? And why does it disappear instantly when another window is rolled down?",11m5ucw,I find myself instantly cracking my window anytime someone rolls down theirs just to avoid this and was wondering why it happens.,CathartiacArrest,574,9574,0.92
450,Eli5: How do plenty of low sound cumulate?,11m5kcl,"Lets imagine that someone whisper something too low and far to be really audible to me. Now lets imagine that thousand of people do the same altogether, in a big concert room for exemple. Would the noise then become a lot more audible and why? How does the cumulation of very low sound works? Thanks, I can't find a comprehensible answer online!",ImSupposedToStudy,4,0,0.5
451,ELI5: Difference Between Block-level Storage and Obect-based Storage?,11m55jx,"I'm going over CompTIA Cloud +, and there seems to be a differentiation between block-level and object-based storage.   


The instructor I'm watching explains that object-based contains metadata as well as normal data, and block-level storage is done as though you are writing data into your drive physically -- in other words, it's great for quick access.  


What I don't understand is what's the difference between the two? Aren't objects also just data stored into a drive? I'm thinking of objects like JSON files.",Capybara_Pulled_Up,4,1,0.6
452,ELI5: How trading based on charts works,11m4gsn,I have seen so many people looking at the ethereum chart for example and analysing it with lots of markers. I found tradingview to be very overwhelming and confusing,Hot_Potato_Salad,1,0,0.5
453,"ELI5: How do jellyfish /angler fish, (any fish that has long tentacle like features) not get tangled?",11m4e1s,I was watching planet earth on Netflix. And even thought back to times staring at aquariums.  How do the tentacles not get tangled on these animals or tangled with others in proximity ?,Samjonesbro,1,3,0.59
454,ELI5: I don’t know the best way to phrase this but what is at play that allows us to walk horizontal on steep inclines or hills? what does our body even do when it’s creating an equilibrium?,11m38lj,"The body “seems,” vertical when walking across it, but it feels like it’s working against something, as if it shouldn’t be able to.",lowrentswamp,6,3,0.59
455,"ELI5: How do mitochondria, chloroplasts, and ribosomes reproduce?",11m38do,"This might need a >5 explanation, but a young person who looks up to me for STEM posed an interesting question. I know that mitochondria and chloroplasts have their own DNA, but in high school all we ever cover is how mitosis works with regular cell nuclei. So I said that I suppose it works like that. But then he asked about ribosomes and how cells create new ones before the cell itself duplicates.",jhill515,4,3,0.62
456,eli5 - how do mouse macros work?,11m1a2u,I thought that the extra mouse buttons would just be extra buttons that would read beyond m1-m5 etc but apparently they do not?,SupportButNotLucio,4,1,0.57
457,ELI5: How are FPS and refresh rate (Hz) different?,11m14qd,"Both provide more images sent to your screen per second, I understand that. But how are they not the exact same?",jonielstar,14,2,0.57
458,eli5: Question can someone track me using my MAC Address?,11lz9zx,"Was just wondering If I can get tracked since my Parents asked for my MAC Address and they won't tell me why and I got curious if they are able to track me, I also don't have any clue what a MAC Address is.",Moontan_,17,3,0.59
459,ELI5: What is NORMAL DISTRIBUTION,11lz6hn,"I have understood standard deviation, but could  not clearly understand normal distribution.",The_Unkn0wn_-_,9,0,0.44
460,eli5 What determines an SSD transfer rate?,11lx9rj,Does an SSD(solid state drive)'s transfer rate depend on the flash storage chip or do the transistors on the board make the difference? Is there any way modifying the board impacts speed?,Mookielittle,2,6,0.62
461,eli5: Can someone explain Euler Classes?,11lvaoe,"I just don't see purpose of these. What applications do they have? What do they do? 

Every time I try to read about them, and I have graduate level statistics under my belt, I always just see dense math about their formulation, never anything on why they exist or what they're meant to do or describe.",capnshanty,2,2,1.0
462,ELI5: Why is some water hard & why is some water soft?,11lva8x,"Two weeks ago I moved from the midlands to Somerset (c90 miles) and have swapped softer water for hard hair-wrecking, skin-drying water. Why do different water agencies supply different water?",Iwanttohearthesea,6,6,0.67
463,ELI5%3A%20Why Native Americans and Asian aren’t same race?,11lv7fp,if Native Americans came out of Asian. Ok ethnic is ethnic: culture history etc. but race?? how are they different genetically/physically? And what percentage of Natives and Asians are similar physically especially in body size?,BaseInternational490,8,0,0.13
464,[ELI5] What’s so special about F-15s in a dogfight?,11lthm0,"I know dogfighting is an exception nowadays but when the F-15 was created and for decades past that it has existed in an airspace where BFM was the norm. While in this air meta it has flawlessly killed dozens and upon dozens of enemy fighters, despite… not really having any exceptional traits from what I can tell. It doesn’t have the insane nose authority of the F/A-18, it doesn’t have thrust vectoring like the SU-33D, it doesn’t have the world-class energy retention and acceleration of the F-16, so what makes it so special? How was it able to win every single fight it engaged in during the dogfighting era like that?",_-Ascendancy-_,5,1,1.0
465,ELI5: How do borders between time zones work?,11lt9ex,"There are borders between countries/states, where you can stand in 2 places at the same time.  
But how does this work with the borders between timezones?  
For example: In Poland, it is 11:47 while i type this. In Lithuania, however, it is 12:47. These countries share a border on land.  
Can a person technically stand in 2 timezones at once? And if your house is on the border of a timezone, how would you ever make appointments or be in time for work?",Ieatalot2004,54,22,0.69
466,ELI5: Why are our eyes built to see everything upside down and our brains are trained to flip the image right-side up,11lsrtd,"I have never understood why your eyes just cant give you the image straight-up. I'm sure it would make everything more energy efficient.
EDIT: Thanks for all the amazing explanations!! Ive always wondered why our eyes and our brains do this 😊",Aideraa,89,122,0.84
467,ELI5: plugging a charger into a lamp socket to charge your phone - would that work?,11ls4ca,"I watched an American film (so the plug is American and voltage is whatever voltage they have there) where a character does that at a diner, and I have a strong feeling that it wouldn’t work but I can’t explain why.",gregsScotchEggs,21,0,0.33
468,ELI5: What is the difference between a LAN and a BBS,11lrqx9,"Is it one of those “all thumbs are fingers but not every finger is a thumb” situations, or are they two completely separate things?",hypersucc,9,1,1.0
469,"ELI5 How are tall, narrow towers like the CN Tower built?",11lrj5v,"I'm not talking about high rise buildings, I mean towers like the CN Tower, where you have some tall narrow concrete base, with a much wider concrete oval structure close to the top. Clearly the tops of these towers are too high for any crane to reach? And how do you build that really wide oval structure safely on such a narrow tall underbody?",QuantumHamster,4,1,1.0
470,Eli5: why do berries not spoil as much under the oven,11lp5l5,"I have noticed countless times that a blueberry or grape has rolled under an appliance and weeks later it’s dried out, but not spoiled. But the berries in the refrigerator or countertop 
 spoil quicker.",Sklifosovsky20,3,0,0.33
471,ELI5 How do messaging services like Discord store so much data?,11lozmc,"Surely they have billions and billions of messages stored between servers, DMs, etc. It seems like it would take an ENORMOUS amount of storage space. I think the largest hard drive/solid state drive is 100 TB. It seems, to my mind, that the billions of messages are too much to store, even with many, many large capacity storage devices. Obviously, I’m incorrect. But I’m wondering why. Are there alternate storage systems for huge storage needs like that? Either way, how is so much data stored? Thank you in advance!",fluffymoofah,39,32,0.78
472,Eli5 Do animals eyesights vary as much as humans do?,11lmxiq,"So whenever I try to look this up I always get animals eyesight compared to humans as a whole, but humans eyesights vary quite a bit….. so for example, is it as common for a golden retriever to have worse eyesight than another golden retriever like how a human can have different vision than another human",mynonepornaccount,8,19,0.81
