,Title,Id,Text,Author,Number of Comments,Number of upvotes,Ratio of Upvotes
47,ELI5: Why is it better to transplant to gradually larger pots instead of putting a plant into a pot that it can grow into and then not disturb it?,11uwyrs,"Why do some potted plants benefit from being root bound and transplanting should be regularly done to gradually larger pots? When they grow in the ground there’s unrestricted space, so why do you want to avoid planting them in a larger pot to begin with?",Freshies00,49,683,0.95
48,ELI5: What is the difference between Median and Average?,11uwkjf,"I was looking up the average networth of 30 year olds in the United States and it said: ""The average net worth is $122,000 and the median net worth is $35,112"" my brain is too smooth please help.",TheAntiCoomLord,56,37,0.71
49,ELI5: If I have a 250ms reaction speed does that mean that my brain just processes things slow or do I live 250ms behind,11uwjwa,Perhaps I should word it better. Do I process stuff in 250ms or do I process it instantly but see and hear the world as it is 250ms behind?,you-cut-the-ponytail,8,2,0.63
50,ELI5 why does the torque converter suffer no dmg when you press the brakes and the pump is still going?,11uvv7i,Like the question says why doesn't it suffer no dmg when you are stopped (like at a red light) and the TC is still generating torque thus building up pressure in the turbine? Btw is it safe to not press the brakes when an incline allows me not to press the brake to be stationary?,DarkFireGerugex,3,1,0.67
51,"eli5 How do ""fake eyes"" develop in animals and plants?",11uv5pk,"I've seen that various plants and animals have developed fake eyes (ie the ears of tigers) or they disguise themselves as leaves or plants disguise as bugs and animals. 
How does this happen? Is it just natural selection and random characteristics? It feels too specific to be just ""luck""",jackreding85,18,1,0.67
52,ELI5 Why do we say the the universe *is* expanding rather than *was* expanding?,11utq5f,"That light, including redshifted light from distant galaxies  is millions/billions of years old. 

Lets say a galaxy 1 billion lightyears away stops moving away from us tomorrow, puts on the reverse gear, and starts moving towards us -  we wouldnt know this for another billion years in to the future. 

So what makes us so sure the universe *is* expanding rather than *was* expanding ? 

Thanks 👍",Ballchinian2,11,0,0.43
53,"ELI5 - How is it that the first Mario Bros. game was about 32kb, but a JPEG of the game is over 300kbs in 2023?",11usao7,"I've seen the meme/info-graphic that the original file for Mario Bros. was approx. 32kb, but a picture file would be 10x more. 

I've googled it and looked, but it seems to have some nebulous answers. Could someone please ELI5?",displacedpie,51,128,0.88
54,Eli5: why are some utensils dishwasher safe and others are not?,11uqseo,Technically isn't every utensil supposed to be dishwasher safe? Like what difference does those utensils have?,_Siri,9,7,0.69
55,"eli5 ""You're more likely to be in an accident in a red car""",11upy1v,"I heard this statement and it confused me. The explanation was more red cars have accidents than other cars. But surely that doesn't translate to ""I personally am more likely to have an accident if I drive a red car than a blue car today""? Assuming there's nothing inherently about red cars that makes them more likely to crash. I'm struggling with the maths theory behind it.

Edit to clarify my question: does the statistic that ""red cars have more accidents"" translate to the statement that ""I, personally, all other things being equal, am more likely to have an accident if I drive a red car than a blue one""?",rosiet1001,85,14,0.64
56,eli5 understanding https,11upe8y,"So from what I can gather in terms of how it works.

Say I visit YouTube and it's HTTPS.

If I click on a video within YouTube that part is hidden? The only thing that will be seen is the fact I visited YouTube itself right?",IonRadleigh387,19,2,0.75
57,ELI5: How does ice make things cold?,11uohj3,"If ice has atoms which are not moving as much, it means that there are less collisions, less kinetic energy and heat 

So if I put ice in a fairly warm liquid, shouldn't the drink become more warmer because the liquid has more kinetic energy than the ice, therefore the heat energy is transfered between the liquid and ice.",JustTransportation51,10,0,0.29
58,eli5 how do (chicken) eggs get produced?,11uo4ej,"I know chickens can lay eggs without doing the deed, but is the egg then not viable for offspring? Do you just wait around and the chicken will eventually lay an egg? 

How do chickens and roosters even do the deed?

Marked NSFW because.. idk it felt weird not marking it NSFW. This came up at brunch - sorry for my weird question about chicken reproduction.",labrume,9,0,0.5
59,ELI5: Why are Hookers (in Rugby) normally short and stocky/fat?,11uno5i,Is it something to do with the scrum structure?,EldenTingz,8,5,0.73
60,"Eli5: How come consuming acid can upset the stomach, when the stomach pH is already so low?",11umkcx,"Given the fact that the stomach pH is already so low, why can consuming acid, e.g. apple cider vinegar or lemon juice already diluted in a glass of water (making it even less acidic), upset the stomach and potentially cause heartburn or acid reflux?

Wouldn’t it be reasonable to assume that ingesting anything above the stomach pH shouldn’t upset the stomach as the stomach pH would become more basic?",Visible_Breath_4541,5,4,0.75
61,"ELI5: When a band appears on a TV show and it is obvious they are lip synching, why do we not hear the drums that are on stage?",11ujjj3,"What I mean by that is, obviously the guitars and other instruments are not plugged in, but the drums don't have that option. So why can we not hear that the drums are actually live? Hopefully that makes sense what I am asking.",docvoit,355,5073,0.93
62,eli5: Does rise of water level depends on the volume or weight of the object submerged?,11ugkge,"Say two identical tanks of volume 100 cubic units filled with water to the same level, and two identical cubes weighing 10 units (same weight) and volume of 5 cubic units and 10 cubic units (different in volume) are immersed in the tank. So does the rise of water is same in the both the tanks or they differ, if so why?",RevolutionaryBid1249,20,6,0.64
63,ELI5: Why is DNA double stranded?,11ugbis,"I don’t understand why there needs to be two strands of DNA bonded together since adenine always bonds to thymine, and guanine always bonds with cytosine. Plus they are antiparallel, so a 3’ end on the first strand would always be paired with a 5’ end on the other strand, and vice versa for the 5’ ends on the first strand. Therefore you would always be able to figure out the second strand from the first strand, right? Isn’t it redundant to have two strands that are basically conveying the same information?",Classic-Asparagus,24,6,0.67
64,ELI5 Why do people experience “blue nose/nostrils” from snorting drugs?,11ufxxy,"Saw someone say in a video she would constantly check her nose during her drug use. Very curious, TIA!!",misozzz,8,4,0.63
65,eli5: Moon origins,11uetw2,"If Earth's moon is result of collision between Earth and some planet/asteroid, is it the same for other planets accross the universe. How about planets with multiple moons. What are scientifically accepted or proposed theories of moon orgins? How about planets with no moon at all. What's the purpose of a moon?",RevolutionaryBid1249,11,0,0.17
66,ELI5: How do people make money from posting on YouTube/other music and streaming platforms?,11uepny,"So what, you post a video and then get 1 billion views, how do people get paid for making videos? How do the people paying them come up with the money? I’ve never understood and I feel like now is a good time to ask.",Cheesenips069,12,5,0.78
67,Eli5: How do we know how long ago a skeletons remains are from?,11ue9ug,"When we find any dinosaurs for example, how does the method work that is used to know how old the remains are?",gilbobrah,21,6,0.72
68,ELI5: How does a more tightly fitted armsyce/arm hole make a garment less likely to pull when you put your arms up?,11udbqo,"I've seen this idea shared in a historical fashion YouTube video (I think Bernadette Banner was talking about historical armsyces vs. modern ones?) and I've seen it again on a crafting sub, and multiple times beyond that. I don't really get it. 

I know people put gussets into the bottom of armsyces for strength and flexibility, so why would a larger arm hole pull more fabric from the rest of the body? Like, why does a closely fitted long sleeve undershit type thing not pull up when you put your arms above your head as much as a loose hoddy does (assuming same torso length on the shirt)? 

I'm too scared to ask the sewing sub. Lol. Thank you! I apologize if I don't respond right away, it's past my bedtime.",ToKeepAndToHoldForev,3,10,0.79
69,Eli5: the Mpemba effect,11uciqz,Hot water freezing faster than cold water,Notabot_legit,5,4,0.83
70,ELI5%3A%20Colorado River - eli5,11ub4cu,Has the Colorado River improved its flow problem with the recent atmospheric rivers or did that only help California’s problems?,Greggie83,3,0,0.14
71,ELI5: Male Pattern Baldness,11ub3c7,Why does this occur? Does this happen to any other mammals? Why that “pattern”?,BMac02,26,18,0.68
72,ELI5: What's modal jazz,11uau8z,"What makes it different from other kinds of jazz?  I started to read about it, and talk of chromatic scales and such made my head 'splode.

And while I'm at it, what's syncopation?


My brain isn't wired for music theory...can you all help me out?",PlatypusGod,6,2,0.75
73,"ELI5 If the cold is the opposite of the heat, why does it also burn?",11ua345,"I understand the cold being able to freeze parts of our body, especially since we are mostly made of water. But I don’t understand how cold temperatures can also cause burns.",Lord_Lykan,7,0,0.5
74,Eli5 How did Ancient Rome build the Colosseum and other monuments? Like the pillars are literally smooth marble practically a perfect cylinder shape,11u8zhg,I’m in Italy now and I just have no idea how they built these pillars. I feel like if that civilisation had the technology we have today they would be miles ahead of us in advancements and architecture,Reasonable-Umpire-93,41,0,0.4
75,ELI5 - How do all the recent “rent to own” house scams work?,11u70vv,"There has been an influx of scam posts all across my neighborhood social media pages advertising “rent to own” properties at a suspiciously low price. The posts include several photographs of the property, rent costing about 1/3 of what similar homes go for in my town, and comments are always turned off. Any ideas on why these scams exist and how do they actually make money?",AlertSanity,11,6,0.64
76,ELI5: how bad is a campfire or burning incense to your lungs?,11u6yz3,Smoke is bad for the lungs but I can't imagine a small amount would be any worse then a cigarette or vape.,KPeters93,11,5,0.65
77,Eli5 pso- particle swarm optimization,11u5xks,Particle swarm optimization explained in a very easy way- mentioning gbest & pbest.,Aggravating-Purple24,3,0,0.5
78,"eli5: MP4 vs MKV, which is best for downloading",11u5d16,"Hey Guys! I was wondering which is better, MKV or MP4?  My girlfriend occasionally downloads cooking videos from YouTube. The other day I saw that the a 1080p video took more space as an MP4 download than an MKV.  This seemed weird cuz I read somewhere that MKV videos take more space than MP4. 

Which is better for downloading, viewing and preserving for a long term? (here preserving means that the video won't get corrupted if it's kept in the laptop or harddrive for a long time) 

Also please tell me the differences between them and which is better overall, just for my own knowledge.",TATPYWBAWTW497,11,4,0.83
79,Eli5: How does a gravimeter measure tides and rock deformation?,11u4yf5,"I'm not sure how to phrase this, but:

So somehow you can know a rock's density by knowing how much a tide deforms it? And is it different for rock vs ocean?

EDIT: And do you need to be orbiting this body or can you be on the ground?",WonderMoon1,4,2,0.6
80,Eli5: Helicopter down wash,11u3pca,"Can someone please explain to me why down wash occurs in helicopters.

I would imagine that the rotary wings are producing lift by a faster flow of air over the surface above them. Wouldn’t that the produce lift by causing lower pressure above so that air pushes upwards? 
If that is correct, why would downwash occur if the air is moving upwards?

Have I got the entire concept wrong?",Sagittarius1996,20,0,0.44
81,Eli5: why are some prehistoric reptiles not dinosaurs?,11u2nty,I’ve gone my entire life being told “that’s not a dinosaur that’s a (insert what it is) but why? What’s makes one giant lizard a Dinosaur but a different giant reptile not a dinosaur?,Fun-Juice-1034,39,112,0.87
82,Eli5:What happens in the brain when you finally understand something?,11u26yq,Let's say you are stuggling to understand a math concept for a while and suddendly you get it. What mechanism caused it?,BeforeTheMaggotbrain,18,92,0.84
83,ELI5: How do thyroid issues/hormonal imbalances affect weight gain/loss?,11u19m9,"From my understanding, laws of thermodynamics state that you can’t lose weight without burning more calories than you’re taking in.

How can thyroid issues cause you to burn calories more efficiently? How can you spend less calories to take the same action?",malcolmwolters,11,2,0.63
84,"ELI5: If you eat protein during the day, but ""growth and building happens during sleep"", and we ""cant store protein"" like fat and carbs, where is this protein then for later use during sleep?",11u0qm8,"As questioned, as something is amiss and these articles do not paint the complete picture.

All over the web we can read that we cant store protein, and we repair at  night.  Protein is a critical part of this muscle repair.

ok then, where is does my morning egg sit until 11pm when i sleep?",galacticjuggernaut,21,66,0.79
85,ELI5 ChatGPT Vs virtual assistants performance,11u09xr,How is it ChatGPT appears to (on my anecdotal experience anyway ) be better at almost every answer compared to virtual assistants like google or Siri?,salt4urpepper,7,2,0.6
86,ELI5: Why does a recording of a game at 15fps look smoother than the game plays at 15fps?,11tzpvh,"As the title suggests, I'm currently doing a challenge video and I'm recording the game (recording is 60fps always in my OBS) but I'm playing the game at 15fps, the game is awful to play and looks terrible on my screen but in the recording it doesn't look as bad as it does in game, is there a reason for this or is it a placebo?",LeeroyFunsweet,11,3,0.56
87,ELI5 : ethernet communication in automotive,11tz5bx,what is ethernet communication and whats the use of it in a car,welliwanttoknow,4,0,0.5
88,Eli5 if I charge my EV on slow mode will it cost less than a fast mode?,11tz1jt,I can't work out if charging slowly over a longer period of time will cost the same than charging quickly,seael0h,22,6,0.65
89,"ELI5: Is there any confirmed explanation of how life firstly came to be in planet Earth? If so, why can't the process be repeated in a laboratory?",11txwe0,"OK, so further explanation of my question. I know that in some point in the Earth's far past, different molecules somehow became unicellular beings. I've heard theories of lightning striking mud etcetera, but either way, some physical event must have occured. Can't that event be replicated inside a controlled environment in order to simulate unicellular life-creation?",Fisherman_2727,167,229,0.75
90,"ELI5: Why ed25519 keys, with such a small key, are more secure than RSA 4096 bits?",11tvkzg,"I have read a lot about how better are ed25519 keys related to the widely used RSA. But there is something that still bothers me.

My RSA private key is 4096 bytes. So with brute-force, someone needs to try 2^4095 different combinations to get a 50% chance of get my key. ed25519 private key is 256 bytes long. So it requires only 2^255 attempts to get the same 50% chance.

Obviously, there is something I'm not understanding. Can you please explain?",Tairosonloa,4,0,0.45
91,ELI5: What exactly is literary fiction?,11tv9i5,"I have searched it before, but for some reason I just don't really understand what makes it different. What really goes under the name of ""literary fiction?""

What's worse, even, is someone told me I was writing it, but I have no idea what about my writing makes it literary fiction, and I'd like to know that before I classify it as such.",tobiiam,8,0,0.44
92,ELI5: How do people become “un-hypnotized”?,11turvt,"I’ve seen clips of people being hypnotized to think they are an alien, etc… How does the hypnosis end? Has the hypnosis ever been permanent?",magerrager,11,1,0.55
93,ELI5: Can one U.S. state sell or transfer bordering territory to an adjoining state?,11tukb1,"If so, how might this work? Who other than the two state governments would need to approve it? Would the private owners of property in the territory have to agree?",DancingBear2020,7,1,0.67
94,ELI5: why do different SSRIs work differently if they're all SSRIs?,11tucyp,"To clarify:

Why would one SSRI not work for someone, but a different drug, but still an SSRI, work?",ohmom92,4,12,0.66
95,ELI5: Day Trading,11ttakg,I have a friend who runs a side hustle helping people learn to day trade successfully. She offered to help me learn without her course charge even though I keep trying to pay for it she won’t let me! I don’t want to waste a ton of her time learning the absolute bare minimum of what this process is. In the most simple terms - what exactly is it? It sounds like you are betting on when things will change but I’m having a hard time grasping it exactly. Can someone explain it like I’m five please & thank you,oceanaesthetic,20,0,0.33
96,Eli5- Why aren't there giant water droplets on earth?,11tt5h1,Like on the side of a water bottle or from a dropper due to surface tension? Why are there no large bobbles of water? Does it have something to do with how dense the earthbis and gravity?,HolyPizzaPie,4,0,0.5
97,ELI5 how does car weight figure into speed?,11tswyi,Just to elaborate a bit about the point that confuses me; I had an 1000 kg car with 59 kW of power that was faster and felt more powerful than a 1200kg car that had 70 kW power.,ParanoidRecordPlayer,9,0,0.43
98,"ELI5 what ""money printing"" actually means",11ts4qx,"Does it mean they actually print new bills? Or do they just add a zero on an excel sheet and it's done? I saw that the Fed's balance apparently went massively up over the last days, how did they achieve this?",Ok-Charge1983,5,1,0.57
99,"ELI5: why are babies not lactose intolerant to their mothers milk, but i am years later?",11tp7s4,"like i get that we stop producing the enzyme, but why?",the_neighborhood_npc,22,0,0.43
100,"ELI5: How do forever chemicals affect our health, if their main characteristic is not interacting with other chemicals?",11toql9,"When I hear talking about forever chemicals, they are usually described as ""chemicals are not affected by naturally occurring reactions, and that accumulate in the bodies of living beings"". By accumulating, they cause all sorts of health issues. 

What I don't understand is how they cause these health issues. If these chemicals do not participate in regular reactions, how do they cause issues? 

I am not claiming that the research in the subject is wrong, I am missing the link between ""these things don't react with anything"" and ""these things still cause all sorts of health problems"".",rcpz93,57,467,0.91
101,ELI5: How does a computer power supply know what current to provide for the components it serves?,11tntbe,"I understand how it changes the voltage from mains AC to whatever DC, but if you have something that requires a range of currents such as a graphics card, how does the PSU know when it needs 6A vs 500mA, and how does it provide that?",the_topiary,19,1,0.57
102,ELI5 - Wisdom Teeth?! What triggers the body to push them out ?,11tnlbc,"People get them in their teens, in their 20s, 30s even some even in 40s. 

So, what makes the body decide it's time to push one of 'em out?",trustinhedonism,7,3,0.62
103,ELI5: why does exercise heighten emotions?,11tmin4,"When I exercise when I’m depressed and numb, it almost always heightens my emotions and makes me cry. Why does this happen?",ReviewIcy5267,2,3,0.71
104,eli5 why can't we use the same space suits they used to go on the moon in the 50' ?,11tkr7x,Just upgrade them instead of designing new ones,Ice-Ornery,14,0,0.4
105,ELI5 how does large aperture make background blurry in images?,11tkd28,And how does it relate to sensor size?,StarterRabbit,5,0,0.5
106,Eli5 what a coulomb is,11tk2ss,"Please explain to me like im a literal caveman

Ive seen plenty of posts trying to explain what a coulomb is, i already know its a unit of charge, but what does that exactly mean? Please dont use numbers because that further confuses me and if you must please use simple numbers even if they are not true, but they do explain what it is.",Diligent_Western_628,11,0,0.5
107,ELI5: what’s the difference between conditional and unconditional love ?,11tjsmx,Title,650tk,3,1,0.53
108,eli5: How is the universe a hologram,11tj0xe,"I read about a theory that the universe could be a hologram, How did they come to this conclusion?

https://www.sciencefocus.com/space/stephen-hawking-final-theory/amp/",Ivebeendoingurmom,0,0,0.2
109,Eli5 How come it’s hard to come out of low income environments,11timr7,Tbh it’s not for me. Parents are…well not greatly informed and I don’t know how to even start with it,Bee_Clique,16,4,0.67
110,Eli5: Why do tooth aches hurt SO much?,11tih9p,"Going through some dental issues right now. I used to have tons and tons of ear infections when I was younger, but the pain was never *this* intense. What is it about teeth that makes the pain so bad?",CharsOwnRX-78-2,1,1,0.67
111,[ELI5] Mannerisms,11tigcp,Why do we have mannerisms? Is there benefit to that? How do we develop it without knowing?,International-Table1,0,0,0.5
112,Eli5: Why do books have their price included as the back cover?,11tgpo3,"Other than the AriZona 99c tea, I don't know of any other item having its price printed on it. Why do books have it?",ladyNONR,7,7,0.89
113,ELI5: How does a variable-yield nuclear weapon work to allow the operator to control the strength of the explosion?,11tgmst,"When it comes to explosions, I tend to think that 10 sticks of dynamite will explode like 10 sticks of dynamite. 

With a nuke being even more powerful, I'd think all the explodey bits would go off to 11 no matter what happened.",PeteyMcPetey,7,6,0.88
114,ELI5: Why is everything moving towards USB chargers?,11tggr6,"I bought a replacement Sonicare toothbrush recently and now the charger has a USB plug instead of a 2-prong plug. Kind of a pain to have to have yet another converter. There must be something technical I’m missing.

I [think I] understand the benefits for phones and other electronics, but a toothbrush? I’m not plugging this thing into my laptop.",Kinder22,14,3,0.64
115,ELI5 - how do atomic clocks work?,11tfr70,As the title says. How do they work? You just put a battery in and it sets the correct time. How? Inspired by this post https://redd.it/11t9z8q,themissing10mm,8,1,0.67
116,ELI5: how does electricity work,11tfp5y,Like how does it charge our phones and power our TV’s i never understood that.,dojidojj,9,0,0.4
117,eli5 Exchange Rate While Traveling,11teq8y,"I'm an American traveling to Canada for vacation. The current exchange rate is 1 usd to 1.37 can.

Does this mean I get more or less buying power while I'm there?",billbratsky33,9,0,0.4
118,eli5: multiplying two negative numbers,11tecac,"Why does multiplying two negative numbers make a positive number? I understand that is what we learn, but why does that happen",psychobabblestuff,35,9,0.68
119,"ELI5: What does ""bulletproofing"" mean in exercise?",11tdpe2,"I watch alot of exercise related videos on YouTube and other social media platforms. I hear alot of them mention things like ""bulletproof your spine"", ""bulletproof your knees"", ""bulletproof your shoulders"" etc. What does it mean? Sounds like it relates to strength and mobility but that's just regular exercise so it has to be something else, right?",According_Storage157,3,0,0.42
120,eli5: why is vision particularly blurriest when glasses have just come off?,11tdmw1,"i notice my vision being extra blurry just when i’ve taken my glasses off and i get dizzy for a minute then i’m fine, why is this?",xxminie,4,3,0.6
121,ELI5: Why does a can of condensed milk not explode when you boil it?,11tdg7r,So to make dulce de leche you boil a can of condensed milk in water for a few hours. I don't understand why the milk doesnt't start turning to steam and making the can explode. I need someone to explain the physics of it to me please. Thanks!,kaiandersonshubby,10,0,0.45
122,Eli5. Belly buttons. What determines an “innie” Vs “outie”,11td671,My daughter just asked and I have absolutely no idea what factors determine which you end up with.,fsttlkr,6,2,0.57
123,Eli5: Why does the CDC only recommend washing produce in tap water? Is this enough to really clean it?,11tcsv8,From harvest to purchase I’ve got to believe produce is very dirty. It seems that rinsing in tap water wouldn’t be enough. Are there better ways to wash or is this truly enough? (Edit: I’m based in the US.),yellitout,16,7,0.71
