,Title,Id,Text,Author,Number of Comments,Number of upvotes,Ratio of Upvotes
0,ELI5 is looking for new moderators!,11o5bp8,"Hi everyone,

ELI5 is looking for new moderators! If you're interested, please fill out this form:  [https://docs.google.com/forms/d/e/1FAIpQLSfJf3e7WeatSPUMtHTCElxzmCDOaiiYoFAbU4zZXPtW0KJWbg/viewform](https://docs.google.com/forms/d/e/1FAIpQLSfJf3e7WeatSPUMtHTCElxzmCDOaiiYoFAbU4zZXPtW0KJWbg/viewform)

Applications  will be open for several weeks. If you have any questions about what being a mod here entails, please leave a comment in this thread and one  of us will get back to you. R1 always applies, but R3 is (mostly) waived  for this thread.",ELI5_Modteam,28,18,0.76
1,Bots and AI generated answers on r/explainlikeimfive,zh922v,"Recently, there's been a surge in ChatGPT generated posts. These come in two flavours: bots creating and posting answers, and human users generating answers with ChatGPT and copy/pasting them. Regardless of whether they are being posted by bots or by people, answers generated using ChatGPT and other similar programs are a direct violation of R3, which requires all content posted here to be original work. We don't allow copied and pasted answers from anywhere, and that includes from ChatGPT programs. Going forward, any accounts posting answers generated from ChatGPT or similar programs will be permanently banned in order to help ensure a continued level of high-quality and informative answers. We'll also take this time to remind you that bots are not allowed on ELI5 and will be banned when found.",ELI5_Modteam,432,2237,0.96
2,ELI5: Newton's Third Law of Motion,11vkt94,"Newton's Third Law of Motion states that ""Every action has an equal and opposite reaction"". Say you were an 200 lb man pushing a 250 lb object. You'd be putting in, say 260 lbs of force, going forwards. If my understanding is correct, it should be putting in 260 lbs of force on you backwards, which would mean as you push you are sort of just gliding backwards ig. Obviously there is something wrong with my understanding of Newtons Third Law of motion, so can someone explain what Newton's Third Law of Motion does",USA_Ball,125,662,0.9
3,Eli5: how have supply chains not recovered over the last two years?,11uxffz,"I understand how they got delayed initially, but what factors have prevented things from rebounding? For instance, I work in the medical field an am being told some product is ""backordered"" multiple times a week. Besides inventing a time machine, what concrete things are preventing a return to 2019 supplys?",ernirn,1904,9686,0.95
4,"Eli5: If I have 2% neanderthal genes, can we say x generation back one of my ancestors was a 50% neanderthal?",11vsgum,Edit: The number of generations cannot be less than 5 from mathematical point of view but can we put an upper limit?,user0199,34,65,0.81
5,Eli5: How do countries recover from hyper inflation?,11vgg1x,"Pretty much what it says on the tin. I just seen a post showing a picture of a stack of (at least) 1000 notes of 20's in VB (Venezuelan Bolivar), which is apparently only equal to 1 US dollar.

How can they bounce back from this? Is it going to get worse? Countries in the past have experienced inflation and gone back to normal, like Germany, how is this done?",chocobobleh,63,101,0.9
6,"ELI5: When a band appears on a TV show and it is obvious they are lip synching, why do we not hear the drums that are on stage?",11ujjj3,"What I mean by that is, obviously the guitars and other instruments are not plugged in, but the drums don't have that option. So why can we not hear that the drums are actually live? Hopefully that makes sense what I am asking.",docvoit,355,5071,0.93
7,ELI5: Why is it better to transplant to gradually larger pots instead of putting a plant into a pot that it can grow into and then not disturb it?,11uwyrs,"Why do some potted plants benefit from being root bound and transplanting should be regularly done to gradually larger pots? When they grow in the ground there’s unrestricted space, so why do you want to avoid planting them in a larger pot to begin with?",Freshies00,49,680,0.95
8,ELI5: what happens within a peach tree that makes it dependent on freeze hours to bear fruit?,11vb1qm,"My tree produced maybe 8 peaches last year. This year it looks like it’s going to be exploding with fruit based on the number of blossoms I see. I know that they need a certain number of freeze hours to produce fruit, just don’t understand why. Seems the freeze would hurt the tree, not give it super powers.",MontrealInTexas,18,86,0.9
9,"ELI5: when someone with hypothyroidism’s metabolism goes down, does their body’s need for nutrition/calories also go down? In other words, is their body no longer able to process as much of the food as it did before? If not, does their body suffer from the reduced uptake of nutrients?",11vkp3q,"It would seem that a body’s nutrient need should be constant, but I can’t figure out what the reduced metabolism’s effect on the body would be besides weight gain.",Mindless-Bowler,5,18,0.75
10,ELI5: Is there a “freshness” to processed foods that regular consumers don’t experience?,11vvmrc,"Like for example if you get a candy bar like Butterfinger or Cheetos immediately after they’re made at the factory, would it be noticeably different than one you got that’s wrapped at the store? Or is the nature of the manufacturing process that it doesn’t matter if you eat it now or two months from now?",cuatrodemayo,5,5,0.73
11,ELI5 What is the observable universe ?,11vugha,"Title basically 

Prompted by this: 

[https://www.visualcapitalist.com/cp/map-of-the-entire-known-universe/](https://www.visualcapitalist.com/cp/map-of-the-entire-known-universe/)",DraconianGuppy,8,6,0.75
12,ELI5 anaerobic metabolism,11vgzyp,ELI5 idk if anyone can help me but can someone explain like I’m 5 anaerobic metabolism ? TIA :),thotasauras,18,15,0.7
13,ELI5 why are there different sentences for the same crime?,11vwwih,I’m binging this true crime show. It’s basically all pre-meditated first degree murder committed by one person. Each person that is covered is given different sentences. One may get 27 years and another will get 50+. But at the end of the day it’s the same crime.,CabernetTheCat,9,2,1.0
14,Eli5 Rabies hydrophobia,11vkr6d,Eli5 Why can’t people with rabies be plugged into an IV to stay hydrated?,Waddles113,17,8,0.61
15,ELI5: why does blood turn darker when it dries?,11vjlcm,"I might be dumb, but I got a paper cut that bled a bit and then I started to think, why does the colour of blood turn darker when it dries? (Also apologies for my english, it's not my first language)",mystupidasss,4,7,0.67
16,eli5 what are ‘reaction conditions’ referring too in terms of drug synthesis?,11vrn7w,To*,Master-Bar-4283,5,1,0.57
17,ELI5: How Bond Markets work,11vlise,I understand that Bond prices fall as interest rates rise therefore giving a better return. But why do bond prices fall when yields rise?,2WeekTraveller,12,4,0.6
18,"Eli5 in cameras, why and how does zooming affect the maximum aperture",11vqkl3,So apparently the higher the zoom the higher the aperture but that is the best I understood from like 10 different articles. Ok it does that but why and how???,kaitoxfishy,4,2,0.67
19,"Eli5, why the pimsleur method advertisement videos, aren't false advertisement.",11vwuh5,"I keep getting ads (https://youtu.be/TazfmqXmXv8) for this language learning app, and it says that it can have you speaking with a near native accent in 30 days. This to me, is impossible,  so I'm curious how it's not false advertisement when what they're claiming cannot be true.",HydeTime,0,0,0.4
20,Eli5: What is comparative advantage?,11vekrl,"The textbook that I read says that “The theory of comparative advantage demonstrates that rather than trying to remain isolated from other countries, a nation’s businesses can profit by specializing in their most efficient industries.’ But how does this happen? What does it mean to say “Country X has several comparative advantages.”?",tdgiabao,16,11,0.78
21,ELI5: how does chemotherapy work?,11vchtr,"My good friend was recently diagnosed with Large B-Cell Lymphoma. He is undergoing chemotherapy. I haven’t seen him until this round, his third round, and his dad told me the last round he wasn’t talking much or very coherent at all. They’re trying a different one now and this one seems to be way better. But what even is it? 
Also, does chemo make you lose weight and muscle, or does the cancer? 
I don’t want to bother my friend with all of these questions. I try to keep some normalcy, I don’t want to add to his stress. I really appreciate any insight anyone can give me. Thank you so much :)",as6lie,14,15,0.79
22,"ELI5 - How is it that the first Mario Bros. game was about 32kb, but a JPEG of the game is over 300kbs in 2023?",11usao7,"I've seen the meme/info-graphic that the original file for Mario Bros. was approx. 32kb, but a picture file would be 10x more. 

I've googled it and looked, but it seems to have some nebulous answers. Could someone please ELI5?",displacedpie,51,133,0.88
23,ELI5: What will happen to quarks during the Big Rip?,11veazy,"Assuming the Big Rip version of the end of the universe were to occur, and everything starts flying apart from galaxy clusters eventually down to individual atoms, what happens to the universe when all of the quarks that make up the universe get ripped apart by dark energy? Is that even possible?",CursoryRaptor,7,10,0.67
24,ELI5:What is diffraction and scattering of light? Are they the same?,11vgn4u,Why do they make objects look like thery are different in colour. Eg - blue sky in afternoon and orange in evening?,Environmental-Care-6,4,7,0.82
25,Eli5 Different human species,11vcisq,"So Neanderthals and Denisovans are often described as other species (as I’ve heard it, that might be wrong idk) but the definition of species is the ability to have fertile offspring (to my knowledge). I’ve heard that Homo sapiens and other human species ‘boinked’ and also that many people have Neanderthal dna, I know those two facts might not necessarily be related but to me it implies Homo sapiens and Neanderthals had children who were fertile as to pass on those Neanderthal genes to modern day people.
How? Is this species distinction different to tigers and lions with their infertile ligers or is this Neanderthal dna not from inter species mating?",skintbinch,15,7,0.82
26,ELI5: how do translators determine when to have a speaker pause so the translator can provide translation?,11v8xsb,"I work at a state legislature building. A Spanish-speaking gentleman came to testify, and a translator was provided. It seems like every few sentences or so, he would pause and allow her to provide translation of his written testimony. This made me wonder, do translators generally discuss with a person when they should pause and allow for the translator to provide the translation?",bluejaybarrister,3,12,0.76
27,ELI5: How does temporary email works?,11velfr,How websites like 10minutemail or temp-mail provide unlimited disposable email addresses?,hlytus,3,4,0.64
28,ELI5: How does pain related shock affect the body?,11vmsw6,"I see a lot of people say that when you suffer a traumatic injury, shock is dangerous. Is it the pain that causes it?",Weak-Donut-9831,2,0,0.4
29,ELI5: What is the difference between Median and Average?,11uwkjf,"I was looking up the average networth of 30 year olds in the United States and it said: ""The average net worth is $122,000 and the median net worth is $35,112"" my brain is too smooth please help.",TheAntiCoomLord,56,34,0.7
30,ELI5: Why do planes fly on curved path?,11vauky,For eg I've seen on flight tracking app that a plane flying from USA to Dubai was flying over Greenland and descending towards Dubai. Why was it flying on curved path Instead of just flying straight to destination?,Entire_Fan_1811,28,5,0.61
31,ELI5 the process and stages of alcohol intoxication,11v960o,"I’m asking because I can never really tell and want to be safe in the future so I don’t go too overboard and know when to stop.

Now I’ve drank alcohol before, and so far I’ve only felt my face become heavy and how time seems to speed up. Let’s not forget me dropping things and how things start to slow down.",throwaway1331310,5,7,0.67
32,ELI5: How come particles of polishing materials and other abrasives used in the making of stainless steel cookware *do not* get embeded into the material and eventually leach into food during cooking?,11vqtlf,"Thanks in advance for your answers!

*\*additional flairs: Physics? Engineering? I honestly don't know.*",Plumbus4Rent,3,0,0.25
33,Eli5: How did boats and ships made entirely on timber not have leaks when put into water,11vcgi6,Back when ships were made of timber how did they make them so that water wouldn’t sink the ship through the gaps in timber,BigApplePette,8,5,0.73
34,eli5: how do steering wheels work? The mechanics behind it in lay man’s words.,11vtzfy,I’m not an engineering student.,CuriousPastrychef,5,0,0.38
35,ELI5 Cng car fuel tank,11vjxdo,"I know that gasses get denser in the winter because of cold and opposite in summer but when I put a full tank of cng into my car and 3 days later the temps went up by about 10c my tank lost 1/4 of the gas inside it, atleast that's what the fuel gauge says but it's not leaking. Why did that happen? Probably wrong place to ask but I'm still trying.",Alkeemik,13,1,0.55
36,ELI5 : [Molecular Orbital Theory] Why do molecules have both bonding and antibonding molecular orbitals?,11vjjea,"Why do molecules have both bonding and antibonding MOs at the same time? Lets take the example of H2, there is only one pair of 1s orbitals, now they can either combine through destructive or constructive interference to create either Bonding MO or AntiBonding MO, why are they both present?",GameDeveloperUE4,4,1,0.6
37,ELI5: Why do certain countries have ridiculous amount of hydrocarbons(oil and natural gas) and the countries right next to them have virtually none?,11vrgdx,"When looking at hydrocarbon deposits for [oil](https://www.worldometers.info/oil/oil-reserves-by-country/) and [natural gas](https://www.worldometers.info/gas/gas-reserves-by-country/) its strange how 

\- Venezeula has roughly 300 billion barrels of oil reserves yet Brazil, a much larger nation in terms of area has only 16 billion.

\- Qatar has 871 million reserves while the whole of Iraq has 111 million. 

How does this even make sense?",jmoincali,6,0,0.33
38,ELI5: How to understand how much traffic a particular website will be able to handle?,11vgsvi,"I'm going to create a no-code website (perhaps will use webflow) and like any other entrepreneur, I think it's going to be a massive hit. So I need help in understanding how exactly I can estimate how much traffic my website will be able to handle? Logically, cumulative visitors numbers won't be an issue, but amount of instances at once. Please pardon my ignorance as I'm a noobie when it comes to tech.",subject005,2,1,1.0
39,Eli5 - How are the over and under numbers calculated for each team playing?,11vcfyl,I’m looking to bet some for tomorrows march madness. Each team has a different number. Saint Mary’s is under 127.5 yet Florida is 149.5,PeteyNYC,6,0,0.5
40,Eli5: Why is water pooling below my fire-stove pot when there are no holes?,11vbcf1,"We heat our house with a fire-stove, to keep the house humid we put a pot of water on top.  We've had an issue where water will puddle up below the pot and sizzle, we tried lowering the water level. Any ideas on what is causing this and suggestions to fix it? The pot is very new, not sure what it could be.",KandyTG,3,1,0.6
41,"eli5 ""You're more likely to be in an accident in a red car""",11upy1v,"I heard this statement and it confused me. The explanation was more red cars have accidents than other cars. But surely that doesn't translate to ""I personally am more likely to have an accident if I drive a red car than a blue car today""? Assuming there's nothing inherently about red cars that makes them more likely to crash. I'm struggling with the maths theory behind it.

Edit to clarify my question: does the statistic that ""red cars have more accidents"" translate to the statement that ""I, personally, all other things being equal, am more likely to have an accident if I drive a red car than a blue one""?",rosiet1001,85,12,0.62
42,ELI5: Dryer Sheets - How do they work in a drier? How many sheets should you add when drying clothing? What happens if you use too many? What is the benefit of sheets over liquid fabric softener?,11vajs4,Currently doing laundry and truly curious how a drier sheet works.,blastingarrows,6,1,0.6
43,ELI5 7000M humans throws every day toilet paper down the toilet. How come the ocean isn't a paper paste already?,11ve2o7,"I guess there are filtering machinery on the whole process but where is everything going after depuration?

If water is *purified* with chemicals, shouldn't then the ocean be already filled with all kinds of chems?",Xestbin,15,0,0.48
44,ELI5 is there any actual reason why Hispanic people and Asian people look so similar? Or is it just a coincidence,11v9dq7,"I’m Asian, I grew up around Asian people my whole life and I still get mixed up with Hispanic people and Asian people sometimes. One of my best friends is fully Mexican, first time I met her I thought she was asian. Met a lot of Asians I thought were Hispanic too.

I’m thinking maybe it’s gotta do with longitude? Idk",InTheSchoolLib,11,0,0.48
45,ELI5: Why aren't there more females than males in most species?,11v1eep,Would it not be more beneficial for a species (population wise) to have more individuals able of giving birth rather than individuals that only increase the population during reproduction?,Sagster157,8,1,0.53
46,"ELI5: When you fill up a glass with ice and water, why does the volume of water in the glass stay the same even after the ice has melted?",11v6k2z,"Like, if I fill up a glass 3/4 of ice and the rest with water, the glass is still at the same water level even after the ice has melted. You would think the water would take up more volume once in its liquid state….",ans_89,3,0,0.5
47,Eli5: Is there an equilibrium number of criminals?,11vbdv5,"So I tried to look this up and found very few relevant results. Essentially I’m wondering if there is an equilibrium point for the number of criminals in a given population. For example, say in the US there are something like 50,000 drug dealers. If suddenly 40,000 of them were arrested and given life in jail would another 40k people become drug dealers to replace them and if so how long would that take? Or would the overall number of drug dealers in this case decrease in the long run if there were no other societal changes?",mhershey84,12,0,0.43
48,Eli5: why are some utensils dishwasher safe and others are not?,11uqseo,Technically isn't every utensil supposed to be dishwasher safe? Like what difference does those utensils have?,_Siri,9,4,0.62
49,ELI5: What's the difference between interrater reliability and interrater agreement in medical diagnosis?,11uxole,"I've found that these two notions are not exactly the same, but I cannot grasp the distinction between them. Thanks!!",Mrs-Anders,0,2,0.76
50,"ELI5: Is there any confirmed explanation of how life firstly came to be in planet Earth? If so, why can't the process be repeated in a laboratory?",11txwe0,"OK, so further explanation of my question. I know that in some point in the Earth's far past, different molecules somehow became unicellular beings. I've heard theories of lightning striking mud etcetera, but either way, some physical event must have occured. Can't that event be replicated inside a controlled environment in order to simulate unicellular life-creation?",Fisherman_2727,167,233,0.75
51,Eli5 How do sports betting apps have info before the betting public giving them the ability to offer abundant in-game wagering?,11v3rhe,You can bet on anything nowadays and there are far too many bets for humans to manage so I assume computers make all the lines today. I understand tv delays but sites like fanduel have info slightly ahead of the viewing public. How does that work? Also is there a way to be ahead of even them? Having a man on the horn at the event for example.,rfs103181,3,1,0.56
52,ELI5: If I have a 250ms reaction speed does that mean that my brain just processes things slow or do I live 250ms behind,11uwjwa,Perhaps I should word it better. Do I process stuff in 250ms or do I process it instantly but see and hear the world as it is 250ms behind?,you-cut-the-ponytail,8,2,0.67
53,Eli5: why are some prehistoric reptiles not dinosaurs?,11u2nty,I’ve gone my entire life being told “that’s not a dinosaur that’s a (insert what it is) but why? What’s makes one giant lizard a Dinosaur but a different giant reptile not a dinosaur?,Fun-Juice-1034,39,110,0.87
54,"ELI5: How do forever chemicals affect our health, if their main characteristic is not interacting with other chemicals?",11toql9,"When I hear talking about forever chemicals, they are usually described as ""chemicals are not affected by naturally occurring reactions, and that accumulate in the bodies of living beings"". By accumulating, they cause all sorts of health issues. 

What I don't understand is how they cause these health issues. If these chemicals do not participate in regular reactions, how do they cause issues? 

I am not claiming that the research in the subject is wrong, I am missing the link between ""these things don't react with anything"" and ""these things still cause all sorts of health problems"".",rcpz93,57,469,0.91
55,ELI5: Is the speed of a physical object relative to gravity in the vacuum of space?,11v62at,"As an example, the Parker Solar Probe that's currently orbiting the sun has different speeds based on where it is located in its orbit. So does what exactly causes this slow down and speed up. Of course I realize that the gravity of the Sun itself causes the probe to speed up but what causes it to slow down again when it gets farther away from the sun. 

There is no physical drag from any atmosphere obviously so does this just apply to general relativity in a way?",openyoureyetotime,8,0,0.4
56,Eli5:What happens in the brain when you finally understand something?,11u26yq,Let's say you are stuggling to understand a math concept for a while and suddendly you get it. What mechanism caused it?,BeforeTheMaggotbrain,18,98,0.85
58,"Eli5: How come consuming acid can upset the stomach, when the stomach pH is already so low?",11umkcx,"Given the fact that the stomach pH is already so low, why can consuming acid, e.g. apple cider vinegar or lemon juice already diluted in a glass of water (making it even less acidic), upset the stomach and potentially cause heartburn or acid reflux?

Wouldn’t it be reasonable to assume that ingesting anything above the stomach pH shouldn’t upset the stomach as the stomach pH would become more basic?",Visible_Breath_4541,5,4,0.75
59,ELI5 how does CBS score march madness brackets,11uxrsf,"I have 25 correct picks and 134 pts. As far as i can tell, rules would have me with 25 pts.

&#x200B;

[https://www.cbssports.com/fantasy/bracket/games/bpc/rules?ttag=FF23\_lk\_cbssports\_cbb\_bpm\_rules](https://www.cbssports.com/fantasy/bracket/games/bpc/rules?ttag=FF23_lk_cbssports_cbb_bpm_rules)",trail-coffee,4,1,0.57
60,ELI5: Why do so many actors turn director?,11v3emo,"I wouldn’t think those skill sets are easily transferable seeing how much a director is in charge of. Like how did so many of the actors in The Office, also direct episodes? Bonus: does someone else stand in as director when you’re acting in a scene that you’re the director of that entire project?",Onetorulethemalll,12,0,0.38
61,ELI5 why does the torque converter suffer no dmg when you press the brakes and the pump is still going?,11uvv7i,Like the question says why doesn't it suffer no dmg when you are stopped (like at a red light) and the TC is still generating torque thus building up pressure in the turbine? Btw is it safe to not press the brakes when an incline allows me not to press the brake to be stationary?,DarkFireGerugex,3,1,0.67
62,"eli5 How do ""fake eyes"" develop in animals and plants?",11uv5pk,"I've seen that various plants and animals have developed fake eyes (ie the ears of tigers) or they disguise themselves as leaves or plants disguise as bugs and animals. 
How does this happen? Is it just natural selection and random characteristics? It feels too specific to be just ""luck""",jackreding85,18,1,0.67
63,eli5 understanding https,11upe8y,"So from what I can gather in terms of how it works.

Say I visit YouTube and it's HTTPS.

If I click on a video within YouTube that part is hidden? The only thing that will be seen is the fact I visited YouTube itself right?",IonRadleigh387,19,2,0.75
64,"ELI5: If you eat protein during the day, but ""growth and building happens during sleep"", and we ""cant store protein"" like fat and carbs, where is this protein then for later use during sleep?",11u0qm8,"As questioned, as something is amiss and these articles do not paint the complete picture.

All over the web we can read that we cant store protein, and we repair at  night.  Protein is a critical part of this muscle repair.

ok then, where is does my morning egg sit until 11pm when i sleep?",galacticjuggernaut,21,64,0.78
65,ELI5: Male Pattern Baldness,11ub3c7,Why does this occur? Does this happen to any other mammals? Why that “pattern”?,BMac02,26,17,0.67
